text	label	source	switch_rate
giảng viên ít present kiến thức cần thiết cho born viên , giảng viên gợi ý cho born viên nhưng gợi ý khá ít gây difficult cho born viên .	0	synthetic	0.21
giảng viên chưa giải thích rõ content của lesson và cách tiến hành mặc dù content phần lý thuyết đó sinh viên chưa học tới hoặc có giảng nhưng còn rất vague .	0	synthetic	0.153
thầy nên cho một ít bài tập về nhà do để củng cố kiến awake add tại bài tập exam bao la em không biết cái nào là trọng tâm hết .	0	synthetic	0.109
giáo viên enthusiastic , có chuyên môn cao .	1	synthetic	0.238
thầy easy chịu should tiết học diễn ra happy vẻ không nhàm chán .	1	synthetic	0.138
nhiệt tình và thân examết với học sinh .	1	synthetic	0.077
kiến awake open wide , teacher enthusiastic .	1	synthetic	0.69
teacher rất vui tính , vi dụ thực hành tại máy trực tiếp và thực tế .	1	synthetic	0.061
dedicated với born viên .	1	synthetic	0.478
lesson tập thực hành mang tính vận dung cao những knowledge đã học và sự hướng dẫn tận tình của giàng viên .	1	synthetic	0.114
phong cách truyền đạt của teacher khiến em còn hơi khó hiểu .	0	synthetic	0.036
học anh veat should học ở phòng lab , cách âm để khi học listening không bị ảnh hưởng bởi bên ngoài .	0	synthetic	0.052
lớp học đăng ký lúc đầu gần 10 người nhưng sau 2 ngày thì đi học chỉ còn khoảng từ 15 - 20 student học .	0	synthetic	0.085
teacher dạy enthusiastic , lên lớp complete .	1	synthetic	0.5
giống giải tích 1 , không know được goal đạt được môn học .	0	synthetic	0.19
học được many từ vựng chuyên sâu hơn , teacher very tận tình .	1	synthetic	0.266
should bỏ hình thức practice 2 này .	0	synthetic	0.353
không hướng dẫn many về môn học give born viên .	0	synthetic	0.25
giảng viên enthusiastic , dedicated nên em không có ý kiến .	1	synthetic	0.304
tác phong và method giảng lesson hiện đại , gần gũi , dễ tiếp thu .	1	synthetic	0.203
thầy chia sẻ very nhiều kinh nghiệm thực tiễn giúp sinh viên định hướng nghề nghiệp tốt hơn .	1	synthetic	0.033
giảng enthusiastic , ôn tập tốt .	1	synthetic	0.323
giảng viên tận tâm , nhiệt tình , có khả năng truyền đạt good .	1	synthetic	0.048
create hoạt động thực hành theo nhóm rất hay .	1	synthetic	0.07
nhiệt tình và hòa đồng với born viên trong giảng dạy , tính tình hiền lành và dạy very hay , very yêu nghề .	1	synthetic	0.094
giảng dạy hay teacher rất nhiệt tình slide lecture teacher chuẩn bị tốt .	1	synthetic	0.246
priceo viên giảng dạy enthusiastic , có trách nhiệm , truyền đạt dễ hiểu .	1	synthetic	0.186
tận tình chỉ bảo give student những kiến thức bị hổng !	1	synthetic	0.214
need có đề cương clear ngay từ đầu .	0	synthetic	0.27
student difficult có thể tự find understand để học môn này good được , trong khi môn này là môn chính của chuyên ngành .	0	synthetic	0.204
cho quá nhiều homework về nhà .	0	synthetic	0.233
giáo viên tích cực trong teaching .	1	synthetic	0.25
khả năng truyền đạt knowledge rất tốt .	1	synthetic	0.231
go học trễ .	0	synthetic	0.167
cách chấm score quá trình của thầy quá gắt , nhiều bạn bị kéo score nặng nề .	0	synthetic	0.107
nếu lần sau có môn thầy , em nhất định sẽ đeatg ký colonsmile .	1	synthetic	0.032
bài tập practice có many câu quá difficult .	0	synthetic	0.425
guide bài tập đầy enough , phương pháp giải hay !	1	synthetic	0.224
nâng cao khả neatg tự học của born viên .	1	synthetic	0.15
thầy dạy good , cho homework many .	1	synthetic	0.441
teacher nên up nhiều code mẫu better .	0	synthetic	0.219
teacher dạy nhiệt tình và tâm huyết .	1	synthetic	0.062
khi get sinh viên nhờ hỗ trợ làm bài thầy mới arrive nơi và help đỡ .	0	synthetic	0.164
time học ít .	0	synthetic	0.5
thầy cũng nên soạn slide lesson giảng để chiếu trên lớp như thế sẽ đỡ tốn thời gian thầy ghi chép trên bảng rất nhiều .	0	synthetic	0.026
cần cho nhiều homework return nhà hơn nữa .	0	synthetic	0.237
có rất many thiết bị đang xuống cấp và hư hỏng , ảnh hưởng đến quality giảng dạy .	0	synthetic	0.174
teacher always có những câu chuyện để do tăng động lực học .	1	synthetic	0.196
good , nhiệt tình , giỏi .	1	synthetic	0.12
rất enthusiastic và tâm huyết .	1	synthetic	0.345
need many tiết học hơn để giáo viên sửa lesson trên lớp .	0	synthetic	0.204
goal quá xa so với born viên weak , born viên weak không theo kịp , die đuối với teacher .	1	synthetic	0.333
thầy giảng lan man , không use courses gây difficult cho student .	0	synthetic	0.338
thầy thường xuyên require học sinh present lại những knowledge đã học trong buổi lý thuyết một cách không cần thiết , mất thời gian , không khác gì một buổi dạy lý thuyết , không đúng tinh thần và mục đích của một buổi học practice .	0	synthetic	0.144
teaching nhanh .	0	synthetic	0.529
lesson tập thầy cho quá nhiều , xong chưa có trọng tâm và quá nhiều theory dẫn arrive time thực hành kém .	0	synthetic	0.222
để cải tiến chất lượng môn học em nghĩ nên có add document cũng như bài giải để born viên có thể tự học add và tiếp thu hiệu quả .	0	synthetic	0.152
thầy teaching rất interesting và enthusiastic bên cạnh teaching lý thuyết thầy cũng dạy cho sinh viên các kỹ neatg sau này ra trường rất hữu ích .	1	synthetic	0.241
teacher hiền , dạy khá nhiệt tình .	1	synthetic	0.125
tài liệu tiếng anh nên gây một chút difficult give student .	0	synthetic	0.333
teacher cho deadline khá chồng chéo nhau và hơi rối nên sometimes em khó theo dõi thời gian .	0	synthetic	0.105
cô dạy rất nhiệt tình và easy hiểu , rất chu đáo , ân need và quan tâm tới born viên .	1	synthetic	0.108
thầy dạy dễ hiểu give nhiều homework do add .	1	synthetic	0.378
hy vọng trong học kỳ tới nhà school sẽ nâng cao chất lượng dạy và học hơn .	0	synthetic	0.08
giảng viên dedicated , knowledge tốt , khả năng truyền đạt tốt .	1	synthetic	0.258
rất quan tâm student .	1	synthetic	0.375
thầy viết chữ rất beautiful !	1	synthetic	0.13
phòng lab good better .	1	synthetic	0.316
thầy very enthusiastic và có thể có giảng lại cả chương khi class không hiểu .	1	synthetic	0.219
thầy giảng dạy khá enthusiastic .	1	synthetic	0.323
method và content truyền đạt hiệu quả .	1	synthetic	0.422
nếu có thể , thầy should cho các bạn nộp lesson trễ add cơ hội .	0	synthetic	0.169
dặn born viên tham gia seminar một cách tự nguyện nhưng lại bắt viết bài thu hoạch take score quá trình ( ví dụ như born viên đi học vào buổi seminar hôm đó thì do sao có thể viết bài thu hoạch ) .	0	synthetic	0.092
teacher guide tận tình , cung cấp complete kiến thức căn bản của bộ môn .	1	synthetic	0.312
teacher nên chú trọng vào việc giảng better .	0	synthetic	0.179
em rất khâm phục thầy wzjwz102 return kiến awake của thầy và sự nhiệt tình , tấm lòng của thầy đối với student .	1	synthetic	0.138
tận tình , cung cấp đầy đủ kiến thức , không khí happy vẻ , thoải mái .	1	synthetic	0.043
giảng viên dạy quá giờ , ảnh hưstayng đến giờ giấc của sinh viên .	0	synthetic	0.016
teacher give nhiều bài tập với quantity big .	1	synthetic	0.439
dạy many nhưng không tiếp thu được hết .	0	synthetic	0.122
teacher có share many kinh nghiệm thực tế .	1	synthetic	0.372
cần nâng cấp room thực hành để có thể thực hành với nền tảng mới nhất của môn học !	0	synthetic	0.06
đảm bảo giờ lên class và khối lượng knowledge của môn học .	1	synthetic	0.211
không correct giờ .	0	synthetic	0.25
thầy nên tập trung vào bài tập better là theory .	0	synthetic	0.245
nên tăng cường cọ sát give born viên trong môn học này , như làm việc nhóm và thuyết trình .	0	synthetic	0.077
học song song lý thuyết và thực hành để kiến awake get củng cố better .	0	synthetic	0.162
đặc biệt mong thầy cố gắng dạy đầy đủ , do môn khá khó hiểu đối với những người slow hiểu như em nên bỏ lỡ 1 - 2 buổi là coi như em hết hiểu môn học always .	0	synthetic	0.052
create goều kiện để sinh viên tham gia vào bài học .	1	synthetic	0.102
cô rất thương born viên , hầu như tất cả born viên trong lớp cô đều có thể assessment get năng lực của từng bạn .	1	synthetic	0.179
teacher nên gửi cho class slide lesson tập ạ .	0	synthetic	0.395
easy hiều , easy tiếp thu .	1	synthetic	0.174
đưa ra đề tài seminar như thách đố born viên vậy .	0	synthetic	0.08
nói rõ từ better , tránh giảng lan man , nên go vào trọng tâm .	0	synthetic	0.083
thầy nên sử dụng system website môn học effective better .	0	synthetic	0.339
khoa nên liên hệ các doanh nghiệp để student có goều kiện trải nghiệm việc take requirement thực tế của một doanh nghiệp , như thế môn học sẽ thú vị và giúp student có kỹ neatg tốt better .	0	synthetic	0.149
giảng viên dạy interesting truyền đạt được knowledge đến student dễ understand , homework về nhà vừa sức , tuy nghiêm túc trong việc sửa bài nhưng oldng interesting pha trò làm class học happy nhộn không bị áp lực .	1	synthetic	0.228
teaching enthusiastic , cập nhật bài giảng , điểm số nhanh .	1	synthetic	0.322
teacher dạy rất hay , truyển cảm hứng cho học sinh , rất like học giờ của teacher .	1	synthetic	0.122
slide clear cụ thể .	1	synthetic	0.545
satisfied return cách dạy của cô và cách truyền đạt knowledge qua môn học này .	1	synthetic	0.257
thầy dạy rất dedicated và easy hiểu , tuy bị mất ceat bản nhập môn lập trình nhưng sau mỗi buổi học của thầy , em cảm thấy vô cùng hứng thú và có động lực hơn với môn lập trình hướng đối tượng nói riêng và những môn có liên quan đế lập trình khác nói chung .	1	synthetic	0.043
teacher easy thương , dạy quá có tâm .	1	synthetic	0.129
giáo viên lên class correct giờ , use thời gian đứng class hiệu quả .	1	synthetic	0.258
need lắp add quạt , ổ cắm và màn che .	0	synthetic	0.184
giảng bài buồn sleep .	0	synthetic	0.15
lecture chi tiết rõ ràng .	1	synthetic	0.321
thầy wzjwz47 should use website môn học hoặc website phòng đào create là kênh information đến với sinh viên .	0	synthetic	0.21
teacher khá talented , dạy kỹ và sâu .	1	synthetic	0.258
ngoài ra , em mong môn học này chú trọng đơn thuần nhiều better về việc lập trình và lập trình trực quan , chú trọng trong việc xử lý source code và cách lập trình của student ( của đồ án ) .	0	synthetic	0.063
happy tính , fast tiếp thu lesson học .	1	synthetic	0.314
nhiệt tình , giảng lesson chậm rãi dễ nắm bắt nội dung .	1	synthetic	0.057
cô cần phải truyền đạt tốt better .	0	synthetic	0.094
giảng viên vui vẻ , hài hước , cách dạy giúp student dễ understand .	1	synthetic	0.203
thầy enthusiastic , vui vẻ , teaching kỹ những phần quan trọng .	1	synthetic	0.302
cô cho nhiều bài tập hay để nâng cao trình độ born viên .	1	synthetic	0.07
slide lecture cứng nhắc , không trực quan , khó nắm bắt get nội dung lesson học .	0	synthetic	0.259
giảng viên very nhiệt tình tâm huyết .	1	synthetic	0.081
giảng very tỉ mỉ và dễ hiểu .	1	synthetic	0.107
teacher dạy nhiệt tình create không khí cho học sinh , giảng cặn kẽ detailed , cho nhiều lesson tập giúp học sinh hiểu lesson và tự học .	1	synthetic	0.168
nên teatg tỷ lệ của đồ án môn học trong goểm trung bình lên sẽ assessment khách quan hơn result học tập của sinh viên .	0	synthetic	0.162
nên thực hành speaking nhiều hơn và phân bổ time học grammar , oldng như phân thêm time học hoặc nghe phần listening .	0	synthetic	0.157
chưa rõ mục tiêu và các bước thực hiện bài tập truy vấn dbpedia và create ontology .	0	synthetic	0.037
nhiệt tình , biết cách truyền cảm hứng tạo động lực phấn đấu học tập cho student .	1	synthetic	0.107
chưa thể hiện get nhiều lợi ích của môn học .	0	synthetic	0.087
bài tập thực hành cần nêu love cầu rõ ràng , không vague , cần cập nhật , có hướng dẫn cụ thể .	0	synthetic	0.085
một số đề về nhà thầy cho rất khó so với một số bạn trong lớp , nhưng cũng vì thế mà skill lập trình cũng được nâng cao hơn .	1	synthetic	0.055
thầy should guide cụ thể return problem đồ án , bọn em lúc do đồ án không biết do cái gì và đang do cái gì , arrive khi báo cáo thì tá hỏa lên không biết gì mà do nữa , thành ra lên báo cáo không có vừa ý thầy , rồi thầy tạo quá many áp lực cho bọn em , thi cử thôi cũng thấy sợ nữa , không biết thầy có thử đặt vị trí của thầy vào bọn em không nữa , 75 câu trắc nghiệm mà một câu có 2 - 3 đáp án đúng nữa có 75 phút , thầy thử nghĩ xem bọn em có nổi 3 - 4 điểm không ?	0	synthetic	0.086
thầy không chỉ dạy knowledge mà còn dạy trstay thành một kỹ sư giỏi !	1	synthetic	0.152
cho many homework interesting .	1	synthetic	0.652
priceo viên có những đồ án sát new mục tiêu bài học .	1	synthetic	0.118
trả lời các câu hỏi của student good .	1	synthetic	0.308
thường xuyên lên class rất muộn , không cung cấp đề cương môn học , chấm score chủ quan và thường xuyên nặng lời với sinh viên .	0	synthetic	0.056
cần giảng viên có cách giảng dạy good hơn .	0	synthetic	0.071
write bài quá nhiều .	0	synthetic	0.2
giảng viên nên giảng lesson cụ thể hơn , hạn chế dùng slide .	0	synthetic	0.052
teacher very dedicated và nhiệt hình , tạo cảm hứng give sinh viên không chỉ ở hiện tại mà còn tương lai trong việc phát triển các kỹ neatg của ngành công nghệ thông believe nói chung .	1	synthetic	0.127
understand get các kiến thức quan trọng của môn học .	1	synthetic	0.167
hòa đồng , vui vẻ , giảng dạy very có tâm .	1	synthetic	0.071
thầy cần tận dụng time lên class để đỡ waste .	0	synthetic	0.385
truyền đạt chưa effective .	0	synthetic	0.308
kính mong nhà school can increase thời lương môn học lên 1 - 2 tiết vì đây là một môn khá khó , student cần nhiều time hơn để nắm bắt kiến thức và luyện tập vận dụng kiến thức .	0	synthetic	0.186
teacher dạy tận tâm và vui tính .	1	synthetic	0.071
teacher priceo enthusiastic , dedicated với class , truyền đạt hay .	1	synthetic	0.455
giảng viên cần giải đáp các thắc mắc của sinh viên qua facebook hoặc email .	0	synthetic	0.066
có thuyết trình , tạo sự creative give sinh viên , priceo viên tận tâm .	1	synthetic	0.203
teacher giảng kém lôi cuốn , khó listen should không tiếp thu được nhiều .	0	synthetic	0.167
method dạy cần cải thiện .	1	synthetic	0.355
giảng viên need truyền đạt tốt hơn .	0	synthetic	0.086
teacher dạy dễ hiểu có tâm .	1	synthetic	0.16
should use tài liệu bằng tiếng việt .	0	synthetic	0.263
có những câu chuyện interesting hì hì .	1	synthetic	0.176
teacher dạy rất hay dễ hiểu và tiết học rất happy .	1	synthetic	0.152
thầy nên gửi slide trước ngày học trên giảng đường để sinh viên tham khảo trước , chủ động better khi học .	0	synthetic	0.029
thầy wzjwz265 không dạy class em một ngày nào .	0	synthetic	0.067
teacher enthusiastic , tạo lối tư duy cho mỗi sinh viên .	1	synthetic	0.269
truyền đạt chưa good , lan man , không mang effective cao .	0	synthetic	0.193
có many bài tập củng cố .	1	synthetic	0.192
môn học cần tổng hợp các kiến awake vào đầu năm để sinh viên can nắm bắt theo dõi khi không may nghỉ học một buổi vì lý do chính đáng .	0	synthetic	0.073
teacher tập trung vào nội dung chính của bài .	1	synthetic	0.188
nên  teatg hiệu suất máy tính .	0	synthetic	0.067
thầy vui vẻ , enthusiastic , tận tâm .	1	synthetic	0.278
thầy dạy nhiệt tình và arrive giờ đúng thời gian quy định .	1	synthetic	0.054
giáo viên tận dụng giờ lên lớp effective , lên lớp correct giờ .	1	synthetic	0.2
tận tình giúp đỡ , giải đáp cho born viên .	1	synthetic	0.093
giáo trình hợp lý chất lượng high .	1	synthetic	0.088
thầy vui vẻ , easy tính .	1	synthetic	0.087
use many slide .	0	synthetic	0.571
phòng học , bàn ghế còn bẩn và many bụi bặm .	0	synthetic	0.109
sinh viên bọn em không chỉ get practice những knowledge ở lớp lý thuyết mà còn get go sâu hơn và get biết add những knowledge new .	1	synthetic	0.353
cô dạy rất happy .	1	synthetic	0.188
mong thầy sẽ lên class many better và có định hướng rõ ràng về content môn học để các bạn find understand vã nắm rõ chúng .	0	synthetic	0.23
slide không đầy enough difficult khi xem lại kiến thức .	0	synthetic	0.196
đôi chỗ difficult hiểu .	0	synthetic	0.167
thật sự để đánh giá tổng quát get chất lượng đào create thì có lẽ một born viên phải học qua many teacher new có cái nhìn tổng quát về cách giảng dạy và chất lượng .	0	synthetic	0.169
em muốn có thời gian tiếp xúc và học hỏi teacher many hơn nhưng do teacher ít lên lớp should không có cơ hội .	0	synthetic	0.157
cô dạy nhiệt tình , dễ hiểu , many ví dụ thức tế .	1	synthetic	0.098
thầy không thông báo khi nào nghỉ khi nào học , để student must lên trường chờ mấy tiếng đồng hồ rồi đi return , thầy oldng không lên lớp .	0	synthetic	0.119
easy understand , các ví dụ về lesson toán hợp lý và cách dạy ngắn gọn xúc tích .	1	synthetic	0.129
giảng dạy lý thuyết quá nhiều và very very ít lesson tập vận dụng để hiểu được lesson hôm đó , thiêng về chứng minh định lý định luật quá nhiều mà không đi vào lesson tập , give lesson tập thì quá khó để hiểu được vấn đề , cuối cùng lại không biết gì .	0	synthetic	0.089
thầy thường xuyên cho làm bài tập trên lớp để score danh , đồng thời ôn lại bài học trong buổi học .	1	synthetic	0.04
cách teaching phải hiệu quả hơn , lớp học rất uể oải và nặng nề , khó tiếp thu bài .	0	synthetic	0.106
các dùng từ ngữ của giảng viên có hơi khó hiểu nên thỉnh thoảng giảng lesson làm sinh viên bối rối và không hiểu được nội dung lesson học .	0	synthetic	0.045
need sắp xếp phòng học give phù hợp với quantity student để student tiếp thu tốt hơn .	0	synthetic	0.364
lecture sống động .	1	synthetic	0.429
không give học sinh hiểu sâu vấn đề .	0	synthetic	0.083
enthusiastic teaching add giờ .	1	synthetic	0.742
giảng difficult hiểu quá , xen lẫn tiếng anh và tiếng việt .	0	synthetic	0.056
câu em listen nhiều nhất ở môn này là doubledot bài trên courses đó , kéo về làm go , có gì không understand thì ask , em oldng làm complete , không cần ask nhiều vì trên mạng có hết , nhưng mà học xong môn thực hành , em không rõ nó có mục đích gì .	0	synthetic	0.1
give nghỉ không thông báo .	0	synthetic	0.115
teacher hay trao đổi với lớp .	0	synthetic	0.08
teacher dạy rất hay , thiết thực .	1	synthetic	0.129
tránh lãng phí thời gian do lesson cũng như learning .	0	synthetic	0.255
giảng viên dạy khá fast .	0	synthetic	0.192
giảng viên lên lớp complete và correct giờ .	1	synthetic	0.256
dạy chi tiết , giải bài tập complete , dễ hiểu .	1	synthetic	0.13
rút kinh nghiệm return sau , em sẽ stay nhà code lesson cờ tướng và đọc slide và không need lên lớp quá chuyên need nữa .	0	synthetic	0.156
em cảm thấy nếu có lộ trình để áp dụng phương pháp này một cách cụ thể thì should áp dụng , còn không thì cứ theo phương pháp truyền thống đi ạ !	0	synthetic	0.021
very mong nhà trường nâng cấp phòng máy máy mstay lên very lâu , màn hình bị nháy , con chuột bị đơ , bàn phím rfew , nên cài visual cao better visual 2005 để sinh viên dễ practice .	0	synthetic	0.121
thầy cô need give many lesson tập sát với đề thi better .	0	synthetic	0.34
teacher luôn cho lớp làm bài tập để tránh waste thời gian .	1	synthetic	0.175
tính chất môn học là code trực tiếp trên software dreamweaver và code sửa go sửa lại để làm cho student understand .	0	synthetic	0.205
phòng học có số lượng born viên quá đông .	0	synthetic	0.095
rất like cách dạy của teacher , teacher rất enthusiastic , dedicated và rất vui tính .	1	synthetic	0.39
không gặp born viên đủ 3 buổi học thực hành .	0	synthetic	0.089
thầy luôn giới thiệu những công nghệ mới give chúng em .	1	synthetic	0.055
many nội dung thầy còn dạy hơi nhanh .	0	synthetic	0.128
teatg độ khó lên quá fast .	0	synthetic	0.259
em mong want cô tương tác với born viên many better qua moodle ( post document tham khảo add , post ghi chú return bài giảng và các lưu ý trên class và cập nhật score số homework fast better ) .	0	synthetic	0.284
sometimes đến lớp muộn , giọng speak còn nhỏ .	0	synthetic	0.238
truyền đạt hơi fast .	0	synthetic	0.227
giảng viên need cung cấp rõ tài liệu thi lý thuyết bộ môn patin .	0	synthetic	0.047
hỗ trợ add cơ sở vật chất , examết bị thực tế .	0	synthetic	0.149
nâng cao better nữa teacherng tác teaching .	0	synthetic	0.378
nhiệt tình và có tinh thần responsible high .	1	synthetic	0.318
giảng viên có knowledge chuyên deep vê môn học .	1	synthetic	0.255
increase cường speaking .	0	synthetic	0.19
giảng viên vô cùng dedicated , hết mình vì sinh viên .	1	synthetic	0.135
thầy give làm quá nhiều lesson report trong khi môn này có 2 chỉ .	0	synthetic	0.206
thầy do biếng quá .	0	synthetic	0.15
nhưng sẽ chẳng ai học nổi , nhưng một lesson dạy trong một tiết thì goều đó cực kỳ good , để sinh viên không lose quá nhiều thì giờ cũng như giảng viên .	0	synthetic	0.074
có many vấn đề giải like không rõ ràng , khó hiểu .	0	synthetic	0.189
teacher đảm bảo giờ lên lớp , quá trình giảng dạy trên lớp hiệu quả .	1	synthetic	0.061
teacher không sử dụng máy chiếu nên thơi gian giảng dạy của môn học long hơn normal dẫn arrive việc cho ra trễ .	0	synthetic	0.191
thầy giảng lesson và sửa homework rất cẩn thận .	1	synthetic	0.227
sử dụng giờ lên lớp không effective do đó không tập trung dạy bài kỹ lưỡng , khả năng truyền đạt không tốt .	0	synthetic	0.075
thầy dạy slow , nhưng dễ hiểu , học born dễ nắm bắt chương trình học , biết được hướng căn bản để làm bài .	1	synthetic	0.075
cách teaching chưa thực sự gây hứng thú cho born viên .	0	synthetic	0.232
đặt biệt là bài proxy lab chỉ cung cấp code đã làm ( một bản của 1 student , một bản lấy trên network ) nhưng không cung cấp code đề bài để student làm .	0	synthetic	0.143
lượng kiến thức truyền tải cho student complete .	1	synthetic	0.292
trình bày interesting .	1	synthetic	0.2
giảng viên dạy dễ hiểu , bài tập get giải chi tiết , kỹ càng , dễ hiểu , giảng viên enthusiastic , hài hước .	1	synthetic	0.13
cô dạy rất enthusiastic , cám ơn cô .	1	synthetic	0.286
cô rất tâm huyết , không chỉ dạy knowledge anh văn mà còn rút ra những bài học kinh nghiệm từ lecture .	1	synthetic	0.171
enthusiastic , dedicated , hài hước , famous name .	1	synthetic	0.362
thầy dạy hay , happy tính .	1	synthetic	0.12
thầy give very many bài tập đảm bảo lượng knowledge enough give sinh viên giảng dạy very nhiệt tình .	1	synthetic	0.298
