text	label	source	switch_rate
slide priceo trình complete .	1	synthetic	0.56
nhiệt tình teaching , gần gũi với sinh viên .	1	synthetic	0.196
go học complete full score chuyên cần .	0	synthetic	0.333
chưa áp dụng technology thông tin và các thiết bị hỗ trợ give việc giảng dạy .	0	synthetic	0.158
thầy giảng lesson interesting , có many homework ví dụ ngay trên class .	1	synthetic	0.356
content môn học có phần lacking trọng tâm , hầu như là chung chung , khái quát khiến student very difficult nắm get content môn học .	0	synthetic	0.31
cần speak rõ hơn bằng cách trình bày lên bảng tinteresting vì nhìn vào slide .	0	synthetic	0.088
thầy rất tận tình và go dạy rất correct giờ .	1	synthetic	0.143
có thể give born viên go thăm quan nhiều công ty xem quy mô và cách do việc , để help understand rõ hơn vê ngành mình đang học .	0	synthetic	0.164
thấy enthusiastic trong việc trao đổi giúp đỡ return learning .	1	synthetic	0.339
phong cách giảng bài của thầy very gần gũi với sinh viên !	1	synthetic	0.053
giảng dạy kết hợp các hoạt động giải trí có effective .	1	synthetic	0.148
cần tạo các buổi seminar để student can hiểu sâu thêm về các vấn đề trong chuyên ngành nhưng không có trong môn học .	0	synthetic	0.123
thầy enthusiastic , quan tâm tới sinh viên .	1	synthetic	0.238
teaching enthusiastic , hướng dẫn chi tiết arrive lúc sinh viên hiểu !	1	synthetic	0.333
chưa có many tiết do bài tập , chữa bài tập trên lớp .	0	synthetic	0.143
tài liệu được bổ sung many và đầy đủ trên moodle .	1	synthetic	0.098
giảng viên phải should give ví dụ cụ thể những phần quan trọng should nói kỹ can take ví dụ minh họa tránh việc lập đi lập lại many lần sẽ tạo cảm giác boring give sinh viên .	0	synthetic	0.179
nên biên soạn một document của chính trường ta .	0	synthetic	0.167
không giúp đỡ student trong những vấn đề xung quanh .	0	synthetic	0.164
content giảng viên yêu câu seminar hầu như không có document tham khảo và rất ít ứng dụng trong thực tế , suggest có sự thay đổi trong những năm học tới .	0	synthetic	0.148
slide up complete trước mỗi buổi học .	1	synthetic	0.306
content giảng dạy quá boring , khô khan .	0	synthetic	0.378
lượng kiến thức quá nhiều trong một semester .	0	synthetic	0.136
teacher chép bảng many .	0	synthetic	0.409
teacher tận tình guide cách làm , giải quyết những thắc mắc của sinh viên .	1	synthetic	0.171
chúc các thầy teacher , anh chị làm việc vui vẻ !	1	synthetic	0.045
hay , enthusiastic , dễ hiểu .	1	synthetic	0.357
mặc dù nhiệt tình nhưng khi truyền đạt thì lại khó understand , sử dụng ngôn từ gây khó kheat cho việc understand lesson .	0	synthetic	0.123
thầy dạy khá interesting , cung cấp nhiều thông tin liên quan đến môn học , đưa ra nhiều hướng giải quyết khi student gặp problem difficult với đồ án !	1	synthetic	0.182
hy vọng học kỳ sau can học được với teacher .	1	synthetic	0.186
nhiều khi em lên lớp học môn đặc tả hình thức giống như lên lớp học mà không know mình học cái gì .	0	synthetic	0.04
trong khi giảng nói small quá .	0	synthetic	0.103
teacher very dedicated nhiệt tình , quan tâm arrive sinh viên , giảng bài dễ hiểu , kiến thức sâu rộng am hiểu cao .	1	synthetic	0.159
teacher dạy với nhiệt huyết của mình , dù như thế nào , teacher vẫn always mỉm cười và kiên trì giảng bài cho chúng em arrive khi chúng em understand .	1	synthetic	0.115
cô lên lớp đúng giờ , giảng bài rất easy understand cho sinh viên .	1	synthetic	0.102
những information cần thiết như doubledot thời gian dealine , cách nộp lesson usually không dặn lớp practice thứ hai .	0	synthetic	0.239
teacher enthusiastic , easy chịu .	1	synthetic	0.593
giảng viên chưa đi deep vào bản chất của vấn đề , em chỉ học thôi mà không biết bản chất của nó là gì nó có ứng dụng gì sau này cho chuyên nghành của em .	0	synthetic	0.02
đặc biệt hơn là teacher đã bỏ very nhiều teacherng sức trong việc ra bài tập và chấm goểm một cách rõ ràng và minh bạch .	1	synthetic	0.098
cô rất enthusiastic và tận dụng good thời gian .	1	synthetic	0.289
giảng viên tận tâm , nhiệt huyết trong teaching .	1	synthetic	0.18
thầy enthusiastic , gần gũi .	1	synthetic	0.37
giảng viên tận tâm , giảng easy hiểu , easy tiếp thu .	1	synthetic	0.08
lesson tập và có code tham khảo .	1	synthetic	0.1
cần nâng cấp system wifi , vì khi vào phòng thực hành , student không thể truy cập internet , buộc phải xin phép ra ngoài để do lesson .	0	synthetic	0.167
dedicated , nhiệt tình , happy tính , dễ gần với born viên .	1	synthetic	0.25
thầy dạy rất interesting và nhiệt tình .	1	synthetic	0.094
thầy dạy không đúng giờ , không hướng dẫn student practice .	0	synthetic	0.286
giúp đỡ student quá ít .	0	synthetic	0.32
teacher dạy buồn ngủ quá .	0	synthetic	0.095
should kinh mong nội dung môn học được giảm tải cho phù hợp better với đặc thù của một trường technology thông tin .	0	synthetic	0.138
teacher tận tình vui tính .	1	synthetic	0.167
teacher lại kiểu khó tính nữa .	0	synthetic	0.077
create hứng thú give born viên .	1	synthetic	0.357
teacher giảng hay cuốn hút và truyền đạt dễ understand .	1	synthetic	0.133
giáo trình quá few và nội dung không khác nhau là mấy .	0	synthetic	0.037
priceo viên nghỉ dạy liên tục , cuối semester lại tăng học bù , những tiết học bù đó đã ảnh hưởng arrive những đồ án , và trễ deadline .	0	synthetic	0.093
teacher lúc dạy lúc không , không dạy oldng không thông báo , sinh viên tốn thời gian , công sức , tiền bạc rồi ngồi đợi và go về .	0	synthetic	0.098
thầy nên give làm lesson tập tương tự nhau many better một vài lesson để tránh tình trạng forget hoặc các dạng tựa nhau nhưng hơi khác cách làm .	0	synthetic	0.157
không ngờ môn này lại boring đến như vậy , không học được gì từ môn này , teacher dạy boring kinh khủng , hay đi trễ từ 30 - 45 phút , không nhiệt tình .	0	synthetic	0.082
giảng viên assessment wrong điểm và năng lực của học born .	0	synthetic	0.273
thầy nên guide thực hành nhiều better .	0	synthetic	0.3
giảng viên friendly , quan tâm tới sinh viên .	1	synthetic	0.208
môn lập trình hướng đối tượng should cập nhật thêm những nội dung new , easy hiểu và giảng giải cụ thể better .	0	synthetic	0.107
giáo viên nhiệt tình , tâm huyết , khả năng truyền đạt good .	1	synthetic	0.05
thầy dạy very tốt và enthusiastic .	1	synthetic	0.406
cô speak hơi small , nếu lớp ồn sẽ khó nghe .	0	synthetic	0.146
bài tập cô đưa ra many , và khó tìm understand , với kiến thực hiện tại của student thì khó có thể tìm understand và làm tốt bài tập cô ra .	0	synthetic	0.168
giảng viên very nhiệt tình , phương pháp giảng dạy hay , sinh viên nắm bắt kiến awake ngay trên lớp .	1	synthetic	0.071
teacher hướng dẫn thực hành khá complete .	1	synthetic	0.229
được học many kinh nghiệm từ teacher wzjwz163 .	1	synthetic	0.2
knowledge của teacher very tốt , bảo đảm giờ lên lớp .	1	synthetic	0.32
cải thiện lại cơ sở vật chất máy chiếu trong room học .	0	synthetic	0.089
class học quá đông !	0	synthetic	0.167
giảng viên chưa cho homework return nhà để born viên do nên cho 5 bài mỗi chương , không need chữa chỉ need đáp án .	0	synthetic	0.2
mà hiện tại trường ta chưa có , đây là thiệt thòi big đối với tụi em .	0	synthetic	0.043
tôi cảm thấy giảng viên dạy rất good .	1	synthetic	0.081
không biết teacher nào dạy chính thức , mà học usually nghỉ không thông báo trước để born viên đứng chờ sắp hết tiết rồi tự return nhiều lần .	0	synthetic	0.119
cần có sự tương tác keepa giảng viên và student nhiều hơn .	0	synthetic	0.2
giảng viên friendly enthusiastic cstayi mstay .	1	synthetic	0.537
priceo viên có mời các teacherng ty về trình bày , giúp born viên cập nhật kiến awake thực tiễn .	1	synthetic	0.146
giảng viên enthusiastic , giải nhiều lesson tập .	1	synthetic	0.295
bài giảng của teacher rất nhiệt tình .	1	synthetic	0.114
môn học chưa thực tiễn , chưa thu hút student .	0	synthetic	0.184
dạy hơi fast !	0	synthetic	0.333
giảng bài kém thu hút , vị trí đứng giảng không hợp lý , ôn tập cuối kỳ còn chưa tập trung vào problem .	0	synthetic	0.058
giảng viên enthusiastic , bài giảng thu hút .	1	synthetic	0.233
nhờ thầy và giảng viên lý thuyết , em đã hiểu rõ về môn này very many !	1	synthetic	0.113
môn này khá trừu tượng nên mong teacher có nhiều liên tưởng tới thực tiễn better để chúng em có thể hiểu .	0	synthetic	0.07
cần thêm nhiều tài liệu give sinh viên .	0	synthetic	0.077
tăng số tiết dạy lên để sinh viên có nhiều cơ hội hỏi đáp thắc mắc return môn học .	0	synthetic	0.025
teacher nhiệt tình easy hiểu .	1	synthetic	0.24
giảng viên dạy fast .	0	synthetic	0.227
homework trên class nên được giới thiệu ngay từ đầu tiết học để student không tốn thời gian read đề cũng như có thể suy nghĩ cách giải cùng lúc với việc listen giảng .	0	synthetic	0.154
cập nhật lesson tập new .	0	synthetic	0.273
lên lớp ai làm việc người ấy , thầy không có giảng gì add .	0	synthetic	0.067
tận tâm , nhiệt tình , quan tâm đến born viên .	1	synthetic	0.085
feedback giải đáp thắc mắc give student .	1	synthetic	0.476
dạy quá fast .	0	synthetic	0.333
môn này cần làm topic để áp dụng lý thuyết vào thực tiễn mà trên lớp chỉ học một đống lý thuyết và hiếm ai remember đa số khá sad sleep khi lên lớp .	0	synthetic	0.111
giảng viên should đổi mới method teaching , tránh thô cứng , không hấp dẫn student .	0	synthetic	0.36
nhiệt tình , tạo cách proactive cho học sinh tiếp cận với môn học và tham gia các chương trình phong trào liên quan để nâng cao kỹ năng .	1	synthetic	0.059
cô dạy very tận tình , dễ understand .	1	synthetic	0.226
không đáp ứng được nhu cầu của born viên .	0	synthetic	0.095
teacher rất nhiệt tình với chúng em và điều này do em rất satisfied .	1	synthetic	0.227
cách teaching của thầy rất hay và có phần easy hiễu .	1	synthetic	0.212
em xin suggest nhà trường nên bổ sung tài liệu về môn học và cập nhật nội dung .	0	synthetic	0.087
chép lesson very many , waste thời gian nghe giảng .	0	synthetic	0.365
em không học thầy wzjwz178 kỳ này , teacher practice có 2 người nên có lẽ daa nhầm .	0	synthetic	0.207
đề thi môn dài student làm không đủ thời gian .	0	synthetic	0.184
cần add many document cho môn học .	0	synthetic	0.459
teacher teaching tốt .	1	synthetic	0.65
mong thầy có thể hướng dẫn cách cụ thể nhất give những lesson khó .	0	synthetic	0.095
teacher cần cho homework và hướng dẫn many hơn .	0	synthetic	0.356
giáo viên lên class đúng giờ , giảng lesson sôi động .	1	synthetic	0.122
cần xác định rõ mục đích môn học và give sinh viên đề cương detailed môn học trước khi bắt đầu .	0	synthetic	0.116
thầy nói chuyện với student very tự nhiên , share kinh nghiệm thực tế .	1	synthetic	0.257
dạy theo sát program .	1	synthetic	0.444
đề nghị nâng cấp room lab khoa network .	0	synthetic	0.237
teacher cung cấp nhiều kiến thức mới , teacher dạy tận tâm và enthusiastic !	1	synthetic	0.265
có teatg add nhiều ví dụ để minh họa give lý thuyết vì có nhiều phần lý thuyết rất trừu tượng .	1	synthetic	0.096
các require về đồ án môn học should đươc đưa ra chính xác trước khi sinh viên bắt đầu thực hiện chia nhóm và làm đồ án .	0	synthetic	0.085
dạy easy hiểu easy tiếp thu , tập trung vài kiến thức trọng tâm .	1	synthetic	0.066
dạy chưa được kỹ lắm , điểm should thoáng hơn .	0	synthetic	0.068
chưa chuẩn bị kỹ bài giảng để có thể trả lời các thắc mắc của born viên trên lớp .	0	synthetic	0.049
cô khá tận tâm give học born .	1	synthetic	0.241
cần cải cách lại nội dung các lesson thực hành , một số kiến nội dung trong lesson thực hành đã trở should lỗi thời .	0	synthetic	0.083
giảng viên có khả neatg truyền đạt kiến thức good .	1	synthetic	0.102
give làm nhiều lesson tập .	0	synthetic	0.261
thầy cô hướng dẫn đồ án system thông tin cần có thêm một vài buổi gặp mặt với sinh viên và đưa ra lịch cố định trên trường để sinh viên thắc mắc có thể lên hỏi trực tiếp !	0	synthetic	0.046
chỉ thông báo trên class sẽ khó tránh sai sót .	0	synthetic	0.067
cô write ở góc bảng gần chổ bụt giảng khiến nhiều khi khó quan sát được ạ .	0	synthetic	0.054
homework cần đa dạng hơn .	0	synthetic	0.28
nói very small .	0	synthetic	0.462
có lúc làm bài wrong giáo viên nói làm hơi tự ái .	0	synthetic	0.062
em chưa understand rõ cách thức chấm điểm lesson check thực hành .	0	synthetic	0.25
làm lesson tập nhiều mặc dù không understand lắm .	0	synthetic	0.171
teacher dạy easy hiểu , tiết học easy hiểu , sôi nổi .	1	synthetic	0.17
teacher teaching nhiệt tình , truyền cảm .	1	synthetic	0.325
teaching rất chi tiết , easy hiểu và easy tiếp thu .	1	synthetic	0.265
truyền đạt những kiến awake tốt .	1	synthetic	0.125
nếu có thì chỉ guide bằng lý thuyết mà không làm lesson tập mẫu cho student .	0	synthetic	0.263
cô chưa có nhiều kênh homework cho sinh viên .	0	synthetic	0.156
bạn nào khá thì can áp dụng công thức vào bài tập cả class chưa đến 30% còn thực sự hiểu môn học thì rất ít người hiểu .	0	synthetic	0.074
không thực hành get buổi nào .	0	synthetic	0.129
thầy dạy phần lý thuyết hay , nắm bắt get khả neatg của born viên .	1	synthetic	0.149
giáo viên enthusiastic , dạy easy hiểu , tận tình với sinh viên .	1	synthetic	0.197
teacher giảng dạy dedicated nhiệt tình .	1	synthetic	0.314
teacher vui tính , giảng bài dễ hiểu , nhiệt tình .	1	synthetic	0.083
dạy dễ understand , gần gũi sinh viên .	1	synthetic	0.121
teacher dạy rất nhiệt tình và tài liệu của teacher rất cụ thể easy hiểu , teacher hướng dẫn rất tận tình .	1	synthetic	0.09
mong thầy cố gắng trong các semester sau .	0	synthetic	0.15
cần đưa ra nhiều ví dụ minh họa better .	0	synthetic	0.081
giảng viên hoà đồng , vui vẻ , chỉ giảng tận tình student ham học ask .	1	synthetic	0.164
nên có sự thống nhất keepa các giảng viên bộ môn trong đề cương teaching .	0	synthetic	0.162
có những phần knowledge chỉ một nửa lớp được học nhưng giảng viên nghĩ là cả lớp đã học rồi nên chỉ overview , những born viên còn lại khó nắm được .	0	synthetic	0.087
máy tính cập nhật nhanh better .	0	synthetic	0.103
happy , hòa đồng , nhiệt tình .	1	synthetic	0.103
có help đỡ sinh viên học tập nghiên cứu .	1	synthetic	0.098
tuy nhiên cô nên cân nhắc lại return số lượng love cầu đối với student để student không bị khớp vì quá nhiều dẫn đến làm qua loa cho có , như vậy thì kết quả lại không good .	0	synthetic	0.151
teacher rất tận tâm , rất ok , em rất like cách dạy và học của teacher ( mặc dù hơi fast tí ) .	1	synthetic	0.161
mong teacher và nhà trường xem xét lại những điều em vừa speak .	0	synthetic	0.119
teacher tận tâm , enthusiastic , create động lực give student .	1	synthetic	0.518
teacher priceo tận tình , dạy kỹ , thường đưa ra question để xem xét mức độ understand biết của student .	1	synthetic	0.284
cần teatg cương trao đổi giữa sinh viên và teacher .	0	synthetic	0.208
nói chung là nghe không bao giờ nghe rõ get .	0	synthetic	0.087
cách truyền đạt của giáo viên chưa có sức hút đối với sinh viên nhiều give lắm .	0	synthetic	0.038
cô priceo thân thiện easy gần , thực hành nhiều .	1	synthetic	0.111
cần cải tiến trang examết practice .	0	synthetic	0.333
còn hơi kéo time .	0	synthetic	0.391
có nhiều bài tập về nhà cơ bản lẫn nâng cao và giảng viên sửa bài enough .	1	synthetic	0.029
thầy rất hiền và kiên trì giảng dạy cho class mặc dù môn học này đối với em không được hứng thú lắm .	0	synthetic	0.03
đôi lúc giảng lesson hơi fast .	0	synthetic	0.276
teacher nhiệt tình và dạy dễ hiểu .	1	synthetic	0.125
có kiến thức nền tảng này , student can học thêm bất kỳ technology cụ thể nào đó easy , cũng như tiếp thu tinteresting đổi technology mới nhanh chóng .	1	synthetic	0.289
tài liệu hỗ trợ toàn tiếng anh very khó học .	0	synthetic	0.068
chưa receive get gì từ môn học này .	0	synthetic	0.235
thầy need phải give sinh viên biết get học môn này có tác dụng gì và làm get gì khi học xong .	0	synthetic	0.149
suggest increase thời gian thưc hành .	0	synthetic	0.324
support thêm textbook không must slide cho born viên .	0	synthetic	0.436
teacher wzjwz259 rất happy và nhiệt tình .	1	synthetic	0.143
giáo viện enthusiastic , tận tâm .	1	synthetic	0.312
kiến thức được giảng viên trình bày rõ ràng , dễ understand give student .	1	synthetic	0.232
cần add nhiều kit để thực hành .	0	synthetic	0.121
dạy difficult understand quá nhanh .	0	synthetic	0.292
always gần gũi , tham khảo opinion student và thống nhất oldng student .	1	synthetic	0.417
nhà school should đưa môn học này vào thời difficulta biểu bắt buộc stay học kỳ 1 của các sinh viên năm nhất nhằm giúp các em nắm biết được mình should học gì , mình có should chuyển đổi ngành hay không .	0	synthetic	0.102
giảng viên very nhiệt tình trong teaching .	1	synthetic	0.279
slide chuẩn bị chưa tốt .	0	synthetic	0.2
thầy interesting đòi ask sinh viên những điều hơi quá cao .	0	synthetic	0.118
teacher giảng hướng dẫn nhiệt tình .	1	synthetic	0.065
chúng em đã gặp khó khắn với khổ giấy small , model thì big và phức tạp .	0	synthetic	0.178
giảng quá many không đánh vào trọng tâm .	0	synthetic	0.119
em không want speak gì nhưng mong thầy xem lại cách đánh giá sinh viên để fair hơn , cái sinh viên không know không phải chỉ ở cúp tiết mà còn ở cách giảng dạy , truyền đạt ở giảng viên , ví dụ như cô wzjwz324 , rất dễ understand , tận tâm .	0	synthetic	0.101
thầy go trễ .	0	synthetic	0.154
speak open wide nhiều problem về môn học .	1	synthetic	0.405
cần increase cường content nghe và nói để sinh viên giao tiếp tốt hơn bằng tiếng anh .	0	synthetic	0.145
giảng viên tạo goều kiện làm nhiều bài tập .	0	synthetic	0.045
hỗ trợ add return các examết bị dạy và học .	0	synthetic	0.225
ít giải bài tập trên class .	0	synthetic	0.115
bám sát content chính .	1	synthetic	0.333
cần thêm các đoạn code give các giải thuật bổ sung các method để giải quyết các bài toán liệt kê .	0	synthetic	0.137
thông tin đầy đủ return homework và các nguồn tham khảo .	1	synthetic	0.173
cô dedicated , nhiệt tình , method dạy dễ hiểu .	1	synthetic	0.353
teacher giảng very easy hiểu và thú vị , thu hút .	1	synthetic	0.205
giảng viên chỉ cho đồ án và giải đáp các yêu cầu đồ án , không cung cấp tài liệu hay guide cơ bản , sinh viên tự tìm hiểu với lý do là hệ tài năng nên cần tự xoay sstay .	0	synthetic	0.058
môn học toàn knowledge new mẻ , giảng viên should giảng chi tiết better .	0	synthetic	0.269
arrive khi cuối kỳ , chỉ cần born viên mắc một sai sót nhỏ thì sẽ rớt môn .	0	synthetic	0.097
need change cách dạy và nội dung học của phần practice , các bài practice hiện tại của môn mạng computer chưa đảm bảo hiệu quả .	0	synthetic	0.282
cơ sở vật chất , phỏng máy không enough phích cắm cho dụng cụ thực hành và quantity student , máy còn tiềm ẩn nhiều virus .	0	synthetic	0.157
trên lớp lý thuyết giảng viên yêu cầu born viên phải thực hiện đồ án theo những gì mình hướng dẫn , những nhóm born viên bổ sung thêm những liên hệ thực tiễn đều bị cho là sai , không phù hợp với đồ án .	0	synthetic	0.039
teacher giảng bài interesting và hiệu quả !	1	synthetic	0.219
room học nên có rèm che bright để khi chiếu slide được nhìn rõ better .	0	synthetic	0.179
chương trình dạy lý thuyết và practice nên khớp với nhau better , tránh tình trạng practice trước khi học lý thuyết .	0	synthetic	0.181
teacher teaching nhiệt tình , dễ understand .	1	synthetic	0.459
mong giảng viên ngày càng chấn chỉnh việc dạy học để các khoá sau được understand tốt better .	0	synthetic	0.082
thầy dạy very có tâm , và giảng give sinh viên very nhiều thứ !	1	synthetic	0.15
nội dung khảo sat quá dài , nhiều mục lặp go lặp lại , nhiều bạn khảo sát mà không cần read , toàn tích chàn .	0	synthetic	0.046
dạy tốt và rất enthusiastic chỉ dạy hoc born .	1	synthetic	0.318
nhưng học mới thấy knowledge teacher dạy very hay , bám sát thực tế , teacher dạy very nhiệt tình , vui vẻ , khác với mọi người speak .	1	synthetic	0.208
bài tập rất interesting .	1	synthetic	0.176
thầy cô cần cho many dạng homework sát với đề exam better .	0	synthetic	0.327
thầy giảng hay nhưng should tự tin better , nói to better để student hiểu bài một cách rõ ràng better .	1	synthetic	0.217
mong thầy vui tính , gần gũi với student hơn .	1	synthetic	0.188
teacher vui tính , hòa đồng , enthusiastic .	1	synthetic	0.432
cung cấp knowledge trọng tâm .	1	synthetic	0.3
cố gắng truyền đạt một cách tốt nhất để sinh viên get hiểu .	1	synthetic	0.066
giọng của giảng viên small dù đã use micro .	0	synthetic	0.217
teacher có phong cách giảng dạy serious .	1	synthetic	0.413
cô rất vui tính nà , không khí class lúc nào cũng vui hết , cô dạy rất interesting , dễ hiểu !	1	synthetic	0.071
giảng viên teaching rất tốt , thường xuyên cung cấp thêm nhiều knowledge .	1	synthetic	0.24
thầy luôn nhiệt tình , có những chia sẻ rất gần gũi với born viên .	1	synthetic	0.06
thậm chí còn không có bài nào khó bằng các bài trong content của class chuyên tin ở các school cấp 3 .	0	synthetic	0.168
thầy nên có cách dạy mới cho môn học này để được result good cho tất cả mọi người tinteresting vì để rớt rất nhiều người !	0	synthetic	0.114
lịch thi thực hành need get thông báo sớm tới sinh viên và phù hợp với thời gian môn học .	0	synthetic	0.078
cô nên giảng kỹ và detailed từng bài vì nhiều bài đa số các bạn chưa hiểu thì cô lại giảng nhanh để chuyển qua bài khác .	0	synthetic	0.066
nhiệt tình , lên class đúng giờ , dạy easy hiểu .	1	synthetic	0.111
cơ mà em học môn này em understand colonlove .	1	synthetic	0.1
lacking kinh nghiệm truyền đạt .	0	synthetic	0.167
bài giảng interesting .	1	synthetic	0.333
em nghĩ content thực hành nên gần với đồ án hơn .	0	synthetic	0.16
teacher nhiệt huyết và giảng bao quát đề cập đến nhiều khía cạnh của bài học vấn đề .	1	synthetic	0.049
giảng viên giảng lesson kỹ .	1	synthetic	0.12
hệ thống đồ án chấm điểm theo mức độ complete của student , tạo sự ganh đua không hề nhẹ với những nhóm do chung đồ án , kích thích bright tạo không ngừng tìm hiểu xây dựng add chức neatg mới cho đồ án nếu muốn được điểm cao .	1	synthetic	0.14
enthusiastic , tâm huyết .	1	synthetic	0.417
