text	label	source	switch_rate
cô dù đang mang bầu nhưng dạy rất enthusiastic với học sinh , cô thường give bài tập về nhà làm , give sinh viên tính tự giác nhưng không tạo nhiều áp lực .	1	synthetic	0.105
liên hệ knowledge với chuyện thực tiễn .	1	synthetic	0.225
semester 2 cần học riêng theo từng class để có được kết quả learning best .	0	synthetic	0.324
thầy dạy dedicated , giúp đỡ học born , method giảng dạy đạt hiệu quả .	1	synthetic	0.297
teacher giảng lesson hay , cuốn hút người nghe .	1	synthetic	0.167
thầy nên cho nhiều lesson tập better .	0	synthetic	0.188
giảng viên enthusiastic , good với sinh viên .	1	synthetic	0.302
teacher dạy quá giờ so với quy định .	0	synthetic	0.231
tinteresting vào đó should là báo cáo đồ án .	0	synthetic	0.176
cô giảng very hay và thu hút học sinh !	1	synthetic	0.079
theory teacher wzjwz22 giảng khá kỹ nên có chậm better so với quá trình practice , mong room đào tạo làm sao để give quá trình học theory và học practice go song song với nhau .	0	synthetic	0.296
teacher dạy interesting , enthusiastic help đỡ student , easy tính sẵn sàng giải đáp mọi thắc mắc của student .	1	synthetic	0.41
tăng tiết học , 1 tuần học theory chỉ 2 tiết em thấy không đủ .	0	synthetic	0.136
giảng viên dạy tốt , dễ hiểu , happy tính và rất nhiệt tình .	1	synthetic	0.051
proactive , tập trung vào student .	1	synthetic	0.472
giảng viên dạy cực khó understand , khả năng truyền đạt poor , giảng dạy boring khiến student không có hứng thú khi tham gia học tập .	0	synthetic	0.189
thầy hơi difficult tính quá .	0	synthetic	0.13
giảng viên cần cập nhập giáo trình và tài liệu môn học một cách complete hơn trước giờ lên lớp .	0	synthetic	0.064
cô giảng theo cách cô cũng tốt , tuy nhiên , lớp chỉ có một vài bạn học get , interesting answer , những câu cô ask cả lớp có hiểu interesting không , những bạn đó answer là hiểu vậy mà nhiều lúc cô đánh đồng cả lớp hiểu .	0	synthetic	0.129
chưa dedicated với student .	0	synthetic	0.571
học thầy được điểm high .	1	synthetic	0.125
có many câu hỏi hay để born viên cùng thảo luận nhằm find ra many phương pháp khác nhau để tiếp cận vấn đề .	1	synthetic	0.156
enthusiastic , dedicated với student .	1	synthetic	0.722
sự thân thiện giúp decrease căng thẳng trong buổi học .	1	synthetic	0.078
check sát sao hơn tiến trình làm đồ án sinh viên cho phép sinh viên creative many cách mới không quá gò bó .	0	synthetic	0.188
tận tâm với nghề , rất quan tâm đến sinh viên , luôn giải đáp những thắc mắc trong time fast nhất ( kể cả qua gmail ) .	1	synthetic	0.112
đưa ra các criteria tính điểm một cách cụ thể .	0	synthetic	0.17
giảng viên làm rõ được problem , dạy những kiến thức thật sự thiết thực cho sinh viên , truyền đạt những kinh nghiệm thực tế trong quá trình giảng dạy .	1	synthetic	0.04
giảng viên giảng dạy nhiệt tình , lesson học sinh động , dễ hiểu .	1	synthetic	0.048
teacher vào tiết correct giờ , giảng dạy nhiệt tình , tận tâm .	1	synthetic	0.21
cập nhật các phương awake giảng dạy new học sơ lược , tiến tới loại bỏ những môn không cần examết cho ngành sau này should có thêm các class kỹ năng giao tiếp .	0	synthetic	0.105
giảng viên vui tính , easy chịu .	1	synthetic	0.065
nhiệt tình , có cách dạy interesting .	1	synthetic	0.1
thầy dạy interesting , happy vẻ , rất hài lòng .	1	synthetic	0.158
giảng viên nhiệt tình giảng lại nhiều lần một vấn đề difficult tiếp thu .	1	synthetic	0.045
easy hiểu , enthusiastic .	1	synthetic	0.545
giảng viên không cung cấp document cho sinh viên , khả neatg truyền đạt của giảng viên chưa tốt .	1	synthetic	0.104
need practice nhiều lên .	0	synthetic	0.48
cô pretty , dạy tốt .	1	synthetic	0.211
homework lớn trong slide tiếng anh gây khó khăn cho student .	0	synthetic	0.258
rất good , rất nhiệt tình , chu đáo .	1	synthetic	0.083
priceo viên rất enthusiastic và tâm huyết .	1	synthetic	0.333
teacher very nhiệt tình , tâm huyết , giảng chi tiết , ví dụ goển hình tiêu biểu dễ tiếp thu .	1	synthetic	0.1
teacher dạy dễ hiểu , always nhắc lại kiến thức old stay mỗi tiết .	1	synthetic	0.19
teacher luôn muốn student giỏi hơn thông qua việc góp ý và comment .	1	synthetic	0.309
teacher dạy hay nhất là về cuộc sống .	1	synthetic	0.114
thầy wzjwz246 very nhiệt tình trong teaching và always tham khảo thêm many ý kiến của student , usually xuyên discuss trên diễn đàn môn học .	1	synthetic	0.315
quá trình teaching không bám sát đồ án môn học , student phải tự tìm hiều qua nhiều mới báo cáo đồ án kịp tiến độ , không nên tổ chức thi giữa kỳ mà thay vào đó là các homework nhỏ cộng goểm cho student .	0	synthetic	0.173
cám ơn teacher đã quan tâm và chú ý .	1	synthetic	0.118
should thi theo hình thức ra đề .	0	synthetic	0.1
thầy dạy very enthusiastic , hiệu quả .	1	synthetic	0.361
cô rất enthusiastic tuy nhiên cách cô teaching đối với em khá difficult understand .	0	synthetic	0.366
không thấy giảng viên dạy thực hành buổi nào , lên class 2 tiết tâm sự với born viên .	0	synthetic	0.083
giảng viên create sự thu hút đối với sinh viên .	1	synthetic	0.067
thầy tránh method đưa công awake và đưa các ví dụ sinh động .	1	synthetic	0.231
teacher rất nghiêm , song rất nhiệt tình , rất fair , có thưởng có phạt , rất đồng tình với cách xét của teacher , về lecture , rất born động , chèn các video thực tiễn , tư liệu đưa vào rất nhiều , rất cụ thể .	1	synthetic	0.125
giáo viên trẻ trung , neatg động , nhiệt tình , vui vẻ .	1	synthetic	0.036
teacher dạy good colonlove .	1	synthetic	0.227
teacher nhiệt tình hòa đồng .	1	synthetic	0.29
thầy happy tính , easy gần , cstayi open , nhiệt tình , năng nổ .	1	synthetic	0.143
thầy dạy dễ understand , ví dụ thực tế .	1	synthetic	0.118
buổi học cuối cùng trước đợt exam cuối kỳ chưa nói rõ về nội dung sẽ được exam .	0	synthetic	0.077
enthusiastic giảng dạy , hướng dẫn student .	1	synthetic	0.432
thầy nên đưa ra những ví dụ trong khi giảng bài , lý thuyết many rất sad sleep khó tập trung được .	0	synthetic	0.121
tập pabelieve rất easy .	1	synthetic	0.278
method giảng dạy chưa hợp lý , đa phần là đọc slide .	0	synthetic	0.19
bài đồ án cuối kỳ thì phổ biến không rõ ràng phải làm gì để có goểm cao .	0	synthetic	0.027
cách dạy comfortable , gentle , nhiệt tình .	1	synthetic	0.4
trang thiết bị give practice tốt hơn .	0	synthetic	0.316
giáo viên luôn dạy quá thời gian quy định trong khi chỉ có 3 tiết mà teacher dạy gần hết 5 tiết new give nghỉ .	0	synthetic	0.093
anh wzjwz302 rất vui và enthusiastic .	1	synthetic	0.278
teacher very nhiệt tình và create không khí happy vẻ trong lớp học .	1	synthetic	0.22
em xin đề xuất add những buổi practice để nâng high tầm hiệu quả của môn học .	0	synthetic	0.203
nâng cấp quạt trần và máy chiếu của room học !	0	synthetic	0.106
đề nghị giảng viên sử dụng moodle để increase chất lượng dạy học .	0	synthetic	0.065
cô nhiệt tình , teaching tốt , quan tâm tất cả student .	1	synthetic	0.293
tăng time practice , born viên nên được làm việc với các thiết bị thực tế .	0	synthetic	0.272
giảng viên nghỉ quá many !	0	synthetic	0.185
giọng speak của giảng viên difficult nghe .	0	synthetic	0.171
thầy give few dạng homework .	0	synthetic	0.462
cách speak của giảng viên khó nghe .	0	synthetic	0.088
kiến awake dễ understand , tiết học vui .	1	synthetic	0.235
mstay add các class training chuyên ngành .	0	synthetic	0.205
giảng dạy còn một số chỗ hơi difficult hiểu .	0	synthetic	0.077
teacher priceo nhiệt tình trong lúc dạy .	1	synthetic	0.147
few homework return nhà .	0	synthetic	0.579
homework về code hơi ít , thực hành chưa đi đôi với theory .	0	synthetic	0.258
use slide , máy chiếu .	0	synthetic	0.444
giảng viên dedicated , enthusiastic , dạy dễ hiểu .	1	synthetic	0.362
dạy hơi khó hiểu và nói quá fast .	0	synthetic	0.143
thầy very chịu khó lắng nghe ý kiến của sinh viên .	1	synthetic	0.06
priceo viên dạy tân tâm , easy understand .	1	synthetic	0.273
thầy giảng very tốt , em understand gần như mọi thứ thầy dạy và áp dụng tốt nó .	1	synthetic	0.096
thời gian lên lớp born viên chúng em không get học gì từ thầy , chỉ toàn là tự find hiểu .	0	synthetic	0.122
teacher dạy em rất sad ngủ .	0	synthetic	0.25
đánh price môn học sơ sài và không teacherng bằng .	0	synthetic	0.114
cần có cách khác phù hợp better .	0	synthetic	0.1
giảng dạy tích cực và dễ understand .	1	synthetic	0.129
cô rất enthusiastic , vui tính , biết quan tâm học sinh .	1	synthetic	0.182
thầy dạy nhiều kiến awake mới , cập nhật từ thực tế .	1	synthetic	0.077
tuy nhiên , homework thực hành còn hơi đơn giản và chưa thực sự phù hợp với thực tế .	0	synthetic	0.083
speak lý thuyết hay nhưng không know áp dụng vào đâu .	0	synthetic	0.135
should dạy đúng giáo án và thời khóa biểu , đừng kéo long tới 1h30 mới cho ra , trong khi thời khóa biểu là 9h45 là hết .	0	synthetic	0.051
room practice quá chật và thiết bị cũng hạn chế return số lượng chưa đáp ứng được nhu cầu học tập .	0	synthetic	0.165
em thấy nên tăng thêm nhiều homework kèm theo ôn lại khái quát lý thuyết rồi new vào thực hành những phần lý thuyết đã học .	0	synthetic	0.081
giảng viên theo sát chuyên need lớp , giảng dễ hiểu .	1	synthetic	0.058
thật sự em rất mơ hồ return môn học này .	0	synthetic	0.054
suggest giảng viên must theo sát với thực tế hơn .	0	synthetic	0.22
thầy bận lịch của trường nên một vài buổi học thầy không lên class được .	0	synthetic	0.042
thầy bao vui , speak chung chưa bao giờ em thấy học mà vui như thế colonsmile .	1	synthetic	0.039
teacher thường xuyên vắng mặt .	0	synthetic	0.143
teacher dạy rất enthusiastic và dễ hiểu .	1	synthetic	0.389
giảng viên am hiểu deep , giảng lesson tận tâm .	1	synthetic	0.136
giảng viên luôn enthusiastic với sinh viên .	1	synthetic	0.238
teacher giảng bài tận tình , dễ understand ( nếu hỏi riêng ) .	1	synthetic	0.151
dạy có tâm , kỹ và enthusiastic .	1	synthetic	0.323
giảng viên thường đưa những chuyện happy vào buổi học giúp student hứng thú trong giờ học hơn .	1	synthetic	0.126
enthusiastic help đỡ hỗ trợ cho student hiểu bài dark đa .	1	synthetic	0.456
giảng viên need tập trung teaching lợi ích liên quan thực tiễn , tránh gây nhàm chán và lặp lại quá nhiều knowledge old .	0	synthetic	0.192
hay easy understand , enthusiastic .	1	synthetic	0.615
thầy dạy enthusiastic , lecture hay , easy gần !	1	synthetic	0.457
béo quá không good give sức healthy .	0	synthetic	0.312
cô cần quan tâm hơn tới born viên .	0	synthetic	0.114
giảng viên cần change cách giảng dạy .	0	synthetic	0.2
thầy thân examện , dạy easy understand , phương pháp giảng dạy hay .	1	synthetic	0.153
chưa thấy get sự necessary thực sự của môn học đối với ngành nghề cũng như cuộc sống sau này .	0	synthetic	0.137
do học buổi trưa cả thầy và trò đều tired .	0	synthetic	0.073
cô giáo nhiệt tình , happy tính , cố gắng truyền đạt cho born viên .	1	synthetic	0.106
giảng viên dạy easy understand tận tình .	1	synthetic	0.182
em nghĩ là nên decrease số giờ nói theory give thêm giờ do bài tập .	0	synthetic	0.284
teacher very enthusiastic và easy thương .	1	synthetic	0.531
teacher dạy interesting , nhiệt tình , dễ hiểu , tận tâm với sinh viên .	1	synthetic	0.115
tuy nhiên học thầy em có hơi fear vì thầy nổi tiếng difficult khi chấm đồ án .	0	synthetic	0.071
giảng viên enthusiastic , guide tận tâm give born viên .	1	synthetic	0.456
thầy chỉ vô điểm danh và quản lý lớp , người dạy là các student của một câu lạc bộ student đại học quốc gia .	0	synthetic	0.159
enthusiastic , khá dễ hiểu .	1	synthetic	0.385
giảng viên nhiệt tình và tận tâm trong việc giúp student nắm get kiến awake .	1	synthetic	0.215
suggest nhà trường làm tốt khâu cở sở vật chất , em thấy trường mình còn thiếu many về trang thiết bị thực hành cho sinh viên .	0	synthetic	0.094
thầy giảng dạy dedicated .	1	synthetic	0.292
hiện tại các thiết bị phòng lab để practice môn này đều đã hỏng , trong suốt quá trình practice chúng em không thể practice được trên thiết bị , mặc khác oldng chẳng receive được sự support guide nào của giảng viên practice .	0	synthetic	0.25
giảng viên nên sử dụng trang moodle để gửi homework hay thông báo khẩn học bù ngoài dự kiến , gửi bảng điểm , vdotv .	0	synthetic	0.06
giảng lesson còn hơi nhanh .	0	synthetic	0.12
giảng viên tận tâm , help đỡ student khi không understand lesson .	1	synthetic	0.339
speak nhanh quá , should nhấn mạnh ở những cái đáng chú ý .	0	synthetic	0.111
em không có bất cứ sự satisfied nào đối với hoạt động teaching của giảng viên wzjwz297 .	0	synthetic	0.193
teacher thường xuyên gây cười , create hứng thú learning .	1	synthetic	0.339
nên đa phần chúng em phải chia nhau ra để học , như vậy quality rất khó đảm bảo .	0	synthetic	0.119
priceo viên provide tài liệu đầy đủ , đến class đúng giờ , dạy nhiệt tình .	1	synthetic	0.194
slide tiếng việt của school có nhiều chỗ bị wrong .	0	synthetic	0.286
rất like phong cách dạy của thầy x .	1	synthetic	0.135
teacher rất nhiệt tình , tâm lý với born viên .	1	synthetic	0.143
phương pháp dạy học không hấp dẫn , nhàm chán , khả neatg truyền đạt chưa hiệu quả .	0	synthetic	0.024
cô dạy rất mơ hồ , không hứng thú , không nhiệt tình help đỡ born viên .	0	synthetic	0.111
thầy give nghỉ quá nhiều .	0	synthetic	0.12
đồng thời , những tiết thực hành help em understand nhiều better những gì em đọc từ tài liệu .	1	synthetic	0.129
rèn luyện kiến awake chuyên môn , tận tâm , nhiệt tình better .	1	synthetic	0.119
đảm bảo thời gian lên class và sử dụng thời gian lên class hiệu quả .	1	synthetic	0.092
thầy không create được cảm hứng cho student .	0	synthetic	0.256
giảng viên very interesting .	1	synthetic	0.3
teacher nhiệt tình , luôn đảm bảo giờ lên lớp , truyền đạt kiến awake hiệu quả .	1	synthetic	0.16
add nhiều knowledge ngoài mới .	1	synthetic	0.406
chứ em nghĩ phần library standford dùng để phân loại văn bản theo method naive flyes mà teacher wzjwz133 sử dụng và áp dụng được chắc need time để research , tìm hiểu mà không được teacherng bố và give born viên áp dụng thì uổng và tội give teacher wzjwz133 quá !	0	synthetic	0.244
không nắm bắt được knowledge môn học .	0	synthetic	0.237
giảng dạy easy hiểu và có tâm .	1	synthetic	0.069
teacher usually xuyên cho nghỉ .	0	synthetic	0.455
cô hướng dẫn enthusiastic và tận tâm với sinh viên trong môn học .	1	synthetic	0.156
sự enthusiastic và tận tình của giáo viên .	1	synthetic	0.244
document sử dụng nhiều kí hiệu nhưng không clear và các định nghĩa mang tính tổng quát quá cao gây sự difficult hiểu cho sinh viên và difficult khăn cho sự truyền đạt của giảng viên .	0	synthetic	0.121
khả neatg truyền đạt kiến thức chưa high , nhiều born viên difficult understand .	0	synthetic	0.239
thầy give điểm bằng đồ án , rất thực tế !	1	synthetic	0.075
quá easy thương nên student khó lòng mà rớt được .	1	synthetic	0.204
teacher dạy chán .	0	synthetic	0.267
teacher nói tiếng anh easy hiểu nhưng đôi lúc quá nhanh .	0	synthetic	0.115
không know là do môn khó hay sao nhưng em vẫn không hiểu gì về môn này , teacher dạy listen boring boring , không hào hứng learning .	0	synthetic	0.25
chứ nói thật là bọn em do bài tập tại lớp không kịp ạ .	0	synthetic	0.054
cô trả lời các câu hỏi của born viên khá detailed !	1	synthetic	0.235
dễ hiểu , được thực hành many , sôi nổi .	1	synthetic	0.119
sự nhiệt tình , năng động , knowledge good , xinh đẹp , dễ mến , happy vẻ , phát âm chuẩn .	1	synthetic	0.17
khả neatg truyền đạt lại knowledge không được tốt .	0	synthetic	0.22
minh họa thực tiễn lesson học trên computer giúp student hiểu rõ problem .	1	synthetic	0.361
thầy giảng hơi khó hiểu , phức tạp hóa problem , hơi chậm .	0	synthetic	0.103
giảng viên enthusiastic truyền đạt kiến thức cho sinh viên .	1	synthetic	0.172
teacher truyền đạt knowledge tốt , phương pháp hiệu quả để em tiếp thu được môn học .	1	synthetic	0.159
nhất là hạn chế tối đa việc change method dạy liên tục dù biết thầy chỉ có ý good cho born viên nhưng lại có tác dụng ngược .	0	synthetic	0.198
có vài goều bất cập là cô giảng đôi lúc giống như hơi đuối .	0	synthetic	0.033
giảng viên yêu cầu high , khó khăn , gây áp lực tạo sự boring nản cho sinh viên .	0	synthetic	0.09
giảng viên dễ mến , dễ gần gũi với born viên .	1	synthetic	0.087
cho ít bài tập , ví dụ cho easy , bài tập cho khó better nhiều , thầy chép lý thuyết trên bảng và đọc lại y chang , born viên không có kỹ năng giải bài tập một cách uyển chuyển .	0	synthetic	0.052
tài liệu should được đưa lên moodle .	0	synthetic	0.088
không đảm bảo thời gian dạy học , usually dạy quá giờ .	0	synthetic	0.111
teacher dạy quá nhanh .	0	synthetic	0.111
không sử dung tiếng anh trong lúc giảng bài lý thuyết để rồi cả slide bằng tiếng anh oldng không hiểu .	0	synthetic	0.02
teacher vui tính , easy gần , đôi khi hài hước , giúp sinh viên thoải mái tiếp thu kiến thức .	1	synthetic	0.117
teacher wzjwz194 is the best !	1	synthetic	0.08
teacher nhiệt tình , thương student .	1	synthetic	0.303
nội dung teaching hơi khó hiểu , đi nhanh , sinh viên khó nắm bắt kịp lesson giảng .	0	synthetic	0.146
do việc có giáo viên khác vào dạy thế trong khoảng sau keepa kỳ should đã xảy ra một số nhầm lẫn về bài học và cách thức tính điểm đồ án should dẫn arrive một số bạn bị điểm thấp .	0	synthetic	0.071
cần có thiết bị và room học hợp lý better .	0	synthetic	0.195
giảng dạy không truyền đạt được knowledge nhiều cho student .	0	synthetic	0.286
có chia sẻ method học cho student .	1	synthetic	0.476
đối với người lần đầu tìm understand directx với những yêu cầu đặt ra là very khó .	0	synthetic	0.092
giảng dạy thật sự quá fast !	0	synthetic	0.172
happy tính easy chịu với sinh viên .	1	synthetic	0.156
môn học provide nhiều kiến thức cần examết , đặc biệt là cô dạy rất tận tâm và hướng arrive born viên .	1	synthetic	0.18
do nghỉ give năm nhất học quốc phòng nên quá trình học bị gián đoạn .	0	synthetic	0.044
dạy chưa enthusiastic .	0	synthetic	0.476
cô dạy rất interesting , cuốn hút .	1	synthetic	0.111
môn học này rất thú vị và có application nhiều trong thực tiễn cuộc live !	1	synthetic	0.169
bám quá sát slide , ít khi đưa ra ý tưởng mới .	0	synthetic	0.106
cô dạy rất interesting và dễ hiểu .	1	synthetic	0.111
giảng viên tận tình , hay giúp đỡ student .	1	synthetic	0.2
em nghĩ nên giảm bớt program đào create với môn này .	0	synthetic	0.273
khuyến nghị should chia 3 tiết 1 buổi .	0	synthetic	0.083
té patin oldng đau .	0	synthetic	0.105
lesson tập interesting , nâng cao .	1	synthetic	0.25
phong cách giảng bài của teacher tạo sự cuốn hút người listen cảm giác comfortable .	1	synthetic	0.2
giáo viên nên tránh giảng dài dòng , dễ gây difficult hiểu cho student .	0	synthetic	0.176
kiểu đề exam trắc nghiệm quá phức tạp .	0	synthetic	0.079
usually xuyên cho lesson tập do trên lớp để nắm lesson .	0	synthetic	0.3
cách teaching hay .	1	synthetic	0.45
có many lesson toán liên quan thực tiễn .	1	synthetic	0.205
teacher cho chép many .	0	synthetic	0.429
teacher dạy hay và tận tình .	1	synthetic	0.154
easy chịu và giảng easy understand , tạo cảm giác like thú cho student .	1	synthetic	0.338
method giảng dạy hay , thu hút .	1	synthetic	0.297
em nghĩ nhà trường should check kỹ trình độ giảng viên trước khi bố trí để họ dạy một môn học nào đó .	0	synthetic	0.108
khả năng truyền đạt knowledge born viên difficult tiếp thu hết .	0	synthetic	0.276
giảng viên có các hoạt động phù hợp với nội dung bài học , tận tâm , enthusiastic .	1	synthetic	0.123
thầy nói khá nhỏ và nhanh oldng không sử dụng giáo án điện tử làm student very khó tiếp thu .	0	synthetic	0.141
cho born viên use bóng không đạt require , đa số là bóng đã qua use ( môn bóng đá ) .	0	synthetic	0.269
giảng viên tận tình , dạy interesting .	1	synthetic	0.097
teaching có tâm huyết với student , và giảng hiệu quả .	1	synthetic	0.298
teacher wzjwz14 rất dedicated truyền dạy không những kiến thức chuyên môn mà còn rất nhiều kiến thức , kinh nghiệm quý về cuộc live .	1	synthetic	0.117
em rất đồng tình với cách information arrive sinh viên của teacher wzjwz134 , teacher information cho sinh viên qua facebook giúp sinh viên nắm information nhanh hơn qua trang courses hay daa .	1	synthetic	0.213
giảng viên tận tâm , nhiệt tình , kiến awake và khả năng truyền đạt của giảng viên very tốt .	1	synthetic	0.077
thầy có method teaching effective .	1	synthetic	0.7
anh veat stay đại học không thể dạy giống như cấp 3 được khi cô dạy lớp im không sôi nổi , chỉ có vài người giơ tay vì câu ask không mang tính tương tác , câu answer có sẵn trong lesson chỉ cần read lên should nhiều người boring không giơ tay , đi học chỉ để điểm danh .	0	synthetic	0.101
thực sự thì khả năng truyền đạt không hấp dẫn , dễ sad ngủ và khó understand .	0	synthetic	0.11
giảng viên nên chấm deadline return nhà sớm hơn .	0	synthetic	0.044
em cảm thấy satisfied với môn này .	1	synthetic	0.235
thầy lên class sớm .	1	synthetic	0.167
help born viên nâng high được khả năng lập trình .	1	synthetic	0.224
thầy thông cảm cho sinh viên , ra lesson tập vừa sức .	1	synthetic	0.059
cần mớ lớp anh văn add để nâng cao trình độ cho student .	0	synthetic	0.217
thầy speak very lôi cuốn ( mặc dù không need micro ) .	1	synthetic	0.18
cần increase thêm số lượng examết bị thực hành .	0	synthetic	0.163
mong teacher cho thêm bài tập return nhà và share slide .	0	synthetic	0.22
giáo viên dạy đúng giờ , tận tình giải đáp những thắc mắc của student .	1	synthetic	0.111
nhưng thầy thử nghĩ nếu em want ngủ mà cứ must lên class thì thầy có like khi nhìn xuống class giảng viên thì dạy , sinh viên thì ngủ mà vẫn có điểm danh như vậy thì có được không .	0	synthetic	0.107
mstay các class tiếng anh tăng cường , để student được cải tiến chất lượng học tập good hơn , không tính score vào học phần , học phí có thể không free .	0	synthetic	0.135
cần các teacher xây dựng một bộ textbook , tài liệu cụ thể .	0	synthetic	0.237
giảng viên enthusiastic với born viên trong các buổi học .	1	synthetic	0.25
tận tâm , quan tâm student !	1	synthetic	0.3
giảng viên dạy born động , dễ hiểu .	1	synthetic	0.111
